{
  "spec_version": "2.0",
  "name": "car_track_oval",
  "scenario": "car",
  "seed": 1,
  "notes": "Flat asphalt stadium oval, 24 m straights, 7 m radius turns, 2.2 m wide, coned. Baseline for pure-pursuit tuning: no obstacles, no randomization.",
  "vehicle_params": "vehicles/car_rc_default.json",
  "world": {
    "size_m": [
      60,
      40
    ],
    "geo_origin": {
      "lat": 39.7684,
      "lon": -86.1581,
      "alt": 220
    },
    "terrain": {
      "mode": "flat",
      "surface": {
        "material_preset": "asphalt",
        "friction": 0.9,
        "restitution": 0.1
      }
    },
    "lighting": {
      "preset": "noon"
    }
  },
  "spawn": {
    "xy_m": [
      -12.0,
      -7.0
    ],
    "yaw_rad": 0.0,
    "jitter_m": 0.2,
    "jitter_yaw_rad": 0.05
  },
  "track": {
    "centerline_m": [
      [
        -12.0,
        -7.0
      ],
      [
        -11.2,
        -7.0
      ],
      [
        -10.4,
        -7.0
      ],
      [
        -9.6,
        -7.0
      ],
      [
        -8.8,
        -7.0
      ],
      [
        -8.0,
        -7.0
      ],
      [
        -7.2,
        -7.0
      ],
      [
        -6.4,
        -7.0
      ],
      [
        -5.6,
        -7.0
      ],
      [
        -4.8,
        -7.0
      ],
      [
        -4.0,
        -7.0
      ],
      [
        -3.2,
        -7.0
      ],
      [
        -2.4,
        -7.0
      ],
      [
        -1.6,
        -7.0
      ],
      [
        -0.8,
        -7.0
      ],
      [
        0.0,
        -7.0
      ],
      [
        0.8,
        -7.0
      ],
      [
        1.6,
        -7.0
      ],
      [
        2.4,
        -7.0
      ],
      [
        3.2,
        -7.0
      ],
      [
        4.0,
        -7.0
      ],
      [
        4.8,
        -7.0
      ],
      [
        5.6,
        -7.0
      ],
      [
        6.4,
        -7.0
      ],
      [
        7.2,
        -7.0
      ],
      [
        8.0,
        -7.0
      ],
      [
        8.8,
        -7.0
      ],
      [
        9.6,
        -7.0
      ],
      [
        10.4,
        -7.0
      ],
      [
        11.2,
        -7.0
      ],
      [
        12.0,
        -7.0
      ],
      [
        12.732,
        -6.962
      ],
      [
        13.455,
        -6.847
      ],
      [
        14.163,
        -6.657
      ],
      [
        14.847,
        -6.395
      ],
      [
        15.5,
        -6.062
      ],
      [
        16.114,
        -5.663
      ],
      [
        16.684,
        -5.202
      ],
      [
        17.202,
        -4.684
      ],
      [
        17.663,
        -4.114
      ],
      [
        18.062,
        -3.5
      ],
      [
        18.395,
        -2.847
      ],
      [
        18.657,
        -2.163
      ],
      [
        18.847,
        -1.455
      ],
      [
        18.962,
        -0.732
      ],
      [
        19.0,
        -0.0
      ],
      [
        18.962,
        0.732
      ],
      [
        18.847,
        1.455
      ],
      [
        18.657,
        2.163
      ],
      [
        18.395,
        2.847
      ],
      [
        18.062,
        3.5
      ],
      [
        17.663,
        4.114
      ],
      [
        17.202,
        4.684
      ],
      [
        16.684,
        5.202
      ],
      [
        16.114,
        5.663
      ],
      [
        15.5,
        6.062
      ],
      [
        14.847,
        6.395
      ],
      [
        14.163,
        6.657
      ],
      [
        13.455,
        6.847
      ],
      [
        12.732,
        6.962
      ],
      [
        12.0,
        7.0
      ],
      [
        11.2,
        7.0
      ],
      [
        10.4,
        7.0
      ],
      [
        9.6,
        7.0
      ],
      [
        8.8,
        7.0
      ],
      [
        8.0,
        7.0
      ],
      [
        7.2,
        7.0
      ],
      [
        6.4,
        7.0
      ],
      [
        5.6,
        7.0
      ],
      [
        4.8,
        7.0
      ],
      [
        4.0,
        7.0
      ],
      [
        3.2,
        7.0
      ],
      [
        2.4,
        7.0
      ],
      [
        1.6,
        7.0
      ],
      [
        0.8,
        7.0
      ],
      [
        0.0,
        7.0
      ],
      [
        -0.8,
        7.0
      ],
      [
        -1.6,
        7.0
      ],
      [
        -2.4,
        7.0
      ],
      [
        -3.2,
        7.0
      ],
      [
        -4.0,
        7.0
      ],
      [
        -4.8,
        7.0
      ],
      [
        -5.6,
        7.0
      ],
      [
        -6.4,
        7.0
      ],
      [
        -7.2,
        7.0
      ],
      [
        -8.0,
        7.0
      ],
      [
        -8.8,
        7.0
      ],
      [
        -9.6,
        7.0
      ],
      [
        -10.4,
        7.0
      ],
      [
        -11.2,
        7.0
      ],
      [
        -12.0,
        7.0
      ],
      [
        -12.732,
        6.962
      ],
      [
        -13.455,
        6.847
      ],
      [
        -14.163,
        6.657
      ],
      [
        -14.847,
        6.395
      ],
      [
        -15.5,
        6.062
      ],
      [
        -16.114,
        5.663
      ],
      [
        -16.684,
        5.202
      ],
      [
        -17.202,
        4.684
      ],
      [
        -17.663,
        4.114
      ],
      [
        -18.062,
        3.5
      ],
      [
        -18.395,
        2.847
      ],
      [
        -18.657,
        2.163
      ],
      [
        -18.847,
        1.455
      ],
      [
        -18.962,
        0.732
      ],
      [
        -19.0,
        0.0
      ],
      [
        -18.962,
        -0.732
      ],
      [
        -18.847,
        -1.455
      ],
      [
        -18.657,
        -2.163
      ],
      [
        -18.395,
        -2.847
      ],
      [
        -18.062,
        -3.5
      ],
      [
        -17.663,
        -4.114
      ],
      [
        -17.202,
        -4.684
      ],
      [
        -16.684,
        -5.202
      ],
      [
        -16.114,
        -5.663
      ],
      [
        -15.5,
        -6.062
      ],
      [
        -14.847,
        -6.395
      ],
      [
        -14.163,
        -6.657
      ],
      [
        -13.455,
        -6.847
      ],
      [
        -12.732,
        -6.962
      ]
    ],
    "closed": true,
    "width_m": 2.2,
    "border": "cones",
    "border_spacing_m": 2.0
  },
  "objects": [],
  "obstacle_fields": [],
  "task": {
    "type": "lap",
    "laps": 2,
    "tolerance_m": 1.0,
    "max_time_s": 120,
    "fail_on": [
      "collision",
      "off_track",
      "timeout"
    ],
    "metrics": [
      "cross_track_rms",
      "time",
      "collisions",
      "control_effort"
    ]
  },
  "randomization": {
    "enabled": false
  }
}